Date,Transaction,Description,Quantity,Amount (GBP),Reference
10/12/2022,Purchase,Vanguard FTSE All-World UCITS ETF,28,968.48,8KTVSAKU
19/11/2022,Purchase,Vanguard FTSE All-World UCITS ETF GBP,73,2442.22,XYTZ6NEY
19/11/2022,Purchase,iShares FTSE 250 ETF GBP Dist,129,1489.25,DTG9XZBA
04/09/2022,Transfer In,Xtrackers MSCI UK ESG ETF 1D £,328,972.85,5IXZJTOZ
04/09/2022,Transfer In,DB X-TRACKERS MSCI WLD TRN IDX UCITS ETF1,96,1913.28,HMDUEF0T
04/09/2022,Transfer In,iShares Core UK Gilts ETF GBP Dist,43,523.53,SKW3THZI
